job_id,job_title,company,descriptions,location,category,subcategory,type,salary
72810451,full stack developer,agensi pekerjaan randstad sdn bhd - professional,remote 16 days annual leave lucrative increment and performance bonus acquire a solid understanding of system architecture fundamentals and best practices applying them to craft resilient and scalable software solutions showcase adept knowledge of cloud computing platforms such as aws azure and gcp demonstrating the ability to create and deploy it solutions on these platforms construct strategic automation solutions to streamline processes enhance efficiency and minimize manual intervention engineer digital solutions spanning web applications mobile apps and websites overseeing the entire development lifecycle to guarantee a seamless user experience apply expertise in ai and ml technologies tools and practices leveraging them for the creation of intelligent datadriven solutions utilize proficient data modeling skills and python programming to manage intricate data tasks encompassing data analysis and the development of machine learning models uphold advanced knowledge in data governance and adhere to cybersecurity best practices ensuring both data integrity and system security bachelors degree in computer science information technology or a related field masters preferred demonstrated expertise as a full stack developer or in a similar role supported by a robust portfolio of accomplished projects comprehensive understanding of frontend and backend programming languages frameworks and libraries substantial experience with cloud computing services and platforms proficient in python ai ml and data modeling familiarity with principles of data governance and cybersecurity,kuala lumpur,information & communication technology,architects,full time,
72813220,system analyst it,link creation sdn. bhd.,work closely with application leader in order to enhance or create new features and functionalities for application mobile apps perform full software development life cycle design coding testing and implementation carry out unit testing and bug fixing develop and maintain functional documentation of software solutions provide maintenance and support of existing systems diploma or degree holder in information technology computer science or related disciplines experienced in agile full sdlc hands on coding skills for reactjs vuejs or relevant frontend framework mssql mysql postgresql mongodb or relevant backend database familiar with the restful api standard and usage research and figure out industrial best practice for enterprise system integration such as azure aws etc concrete knowledge source control methodology familiar with the software development management tools such as jira mondayscom or relevant passionate to learn propose and adopt new technology tools according to business needs prepare software documents such as functional design specification and technical design specification for projects whats your expected monthly basic salary,petaling,information & communication technology,networks & systems administration,full time,"RM 6,000 – RM 8,400 per month"
72879267,bi developer immediate hiring,mobileone technology sdn bhd,involve in bi data modelling design and development life cycle applied technical skills using ssis ssas microsoft sql server cloud services in data collection data analysis and reporting to procure data from database structures into report data engineering of source systems transformation to data lakedata warehouse development of etl data flow dashboards and report a bachelors degree post graduate diploma professional degree computer science information technology mathematics statistic and data science or equivalent with at least 12 years of experience required skills ms sql serverms sql integration services ssis analysis services ssas power bi dashboards development excellent analytical organization and multitasking skills which of the following relational database management systems rdbms are you experienced with whats your expected monthly basic salary how many years experience do you have as a business intelligence developer which of the following programming languages are you experienced in how would you rate your english language skills how many years experience do you have using sql queries how many years experience do you have as a power bi developer,petaling,science & technology,"mathematics, statistics & information sciences",full time,"RM 3,500 – RM 5,000 per month"
72855769,educational developer technologyenhanced learning 60005,sunway university,design and deliver development opportunities for academic staff on effective tel integration approaches and techniques for various teaching environments and opportunities of designing online curricula that effectively integrate epedagogy principles and teaching practices foster collaboration and knowledge sharing among academic staff in tel through mars webinars and other suitable collaborative sessions collaborate with schools and programmes to identify pedagogical needs and recommend improved tel practices technologies or resources develop guidance materials and tools for using learning platforms techsupported active learning strategies and online learning engagement lead on the development of institutional guidelines on technology covering areas such as blended learning ai online proctored examinations and other relevant topics curate online resources and latest information on tel trends to support academics adoption of tel continuously review and update tel resources to ensure they align with best practices and emerging technologies create and curate instructional materials while utilising contemporary learning theories and instructional design models to ensure effective learning experiences work closely with subject matter experts and various teams to ensure content accuracy and relevance provide guidance and consultations to academic staff on creating effective online learning experiences identify impact and emerging issues based on academics integration of tel and provide evidencebased recommendations for continuous improvement conduct and present evaluations of existing and emerging technology for teaching and learning to stakeholders and institutional decisionmakers continuously improve tel integration practices to ensure improvement and enhancement of teaching and learning across the institution possess a masters degree in education instructional design or related fields of studies at least five 5 years of teaching experience in higher education or equivalent setting including successful experience in adoption of technological tools for teaching learning and assessment at least three 3 years of experience in educational development or related role which involves development of teaching and academicrelated practices for higher education academic staff ability to design develop and deliver effective training programmes for academic staff experience in using learning management systems such as elearnblackboard moodle open learning etc ability to manage projects effectively meet deadlines and deliver results under pressure excellent problemsolving communication and interpersonal skills with the ability collaborate with diverse stakeholders,petaling,education & training,workplace training & assessment,full time,
72728778,data strategist,acgt sdn bhd,gather review curate recode standardize and verify plantation data work with project owners and users to develop digital data collection applications digital approval workflow application and digital production dashboard visualizations for oil palm plantation use cases develop microsoft power applications on webbased and mobile platform for oil palm plantation use cases deploy maintain and support developed applications uncover other areas of plantation operations for digitalization opportunities write clear and wellstructured business requirementsdocuments collaborate with team on roadmap planning and prioritization bsc or msc or professional certification in plantation computer science information technology or any science degree minimum 58 years of experience in microsoft power platform power bi power apps power automate able to develop workflow applications for plantation usage experience in databases and networks excellent interpersonal skills team player resourceful and has strong analytical skills experience in collaborative software development and thriving in a fastpaced and dynamic work environment good communication and written in english whats your expected monthly basic salary how much notice are you required to give your current employer,bukit jalil,science & technology,"mathematics, statistics & information sciences",full time,
72736438,data analyst,ust global (m) sdn bhd,pulling data from various database analyzing it and aggregate it to enable and desired visualization creating reports and dashboard by leveraging the existing tools or using microsoft power bi creating and maintaining dashboards models and data products developing and maintaining databases data systems reorganizing data in a readable format performing analysis to assess quality and meaning of data bachelors degree in industrial engineering computer science data analysis supply chain analytics information systems or any other related field 5 years of experience in application analysis and design business process and concepts 5 years hands on experience in power bi python excel able to analyzed and summarized data pulled from the databases and data system by using microsoft power bi tool able to automate and run live report onto selected tools and systems dates whats your expected monthly basic salary how much notice are you required to give your current employer,penang island,information & communication technology,business/systems analysts,full time,"RM 3,500 – RM 4,500 per month"
72649012,machine learning engineer team lead,agensi pekerjaan randstad sdn bhd - professional,driving machine learning and analytics innovation strategies responsible for leading end to end machine learning and analytics products development overseeing machine learning model lifecycle management collecting and preparing data for analytical work and machine learning modelling to be productionized ensuring continuous integration through mlops or ml pipelines automation work closely with prodcut team data engineering team and software development team for deployment of analytics and ml solutions into production responsible to advice stakeholders and business leaders on technology and strategy pertaining to analytics and machine learning responsible to manage functional and process design testing and protyping along with product and engineering team including leadership team minimum 5 years of experience in machine learning developments and analytics in production environment hands on experience with cloud technology aws would be added advantage must have hands on experience with mlops statistical design and visualization strong knowledge and expertise in ml libraries and framework tensorflow pytorch experience with statistical analysis experimental designs etc experience with dashboarding visualization and data storytelling basic understanding of datalake and data warehousing concepts,kuala lumpur,information & communication technology,networks & systems administration,full time,
72868776,business system analyst,lee automotive & tools sdn bhd,have you worked in a role which requires a sound understanding of the software development lifecycle whats your expected monthly basic salary how many years experience do you have as a business systems analyst,penang,information & communication technology,business/systems analysts,full time,"RM 3,500 – RM 5,000 per month"
72696072,data analyst executive,heng hiap industries sdn. bhd.,extract and process data from the erp system maintaining its accuracy and relevance develop and maintain digital dashboards to display operational and financial data offering realtime insights to management actively participate in planning and preparation for the future implementation of iot systems over the next three years stay informed on iot trends and technologies to ensure seamless future integration and utilization analyze data to uncover trends patterns and actionable insights crucial for business operations and strategic decisionmaking implement advanced data analysis and statistical techniques for predictive analysis analyze data related to environmental social and governance factors to support the organizations sustainability goals provide insights for improving esg performance based on data analysis lead datarelated projects ensuring objectives are met efficiently and effectively collaborate with different departments to understand their data requirements and deliver tailored support keep abreast of the latest trends in data analytics erp systems iot esg and industry 40 recommend and implement improvements in data analysis processes and tools bachelors or masters degree in data science statistics computer science or a related field proven experience in data analysis with a focus on erp systems and data visualization proficiency in statistical software eg r python databases and visualization tools eg tableau power bi strong analytical problemsolving and project management skills effective communication skills capable of translating complex data into clear insights forwardthinking mindset with a keen interest in emerging technologies such as iot,johor bahru district,information & communication technology,business/systems analysts,full time,"RM 3,000 – RM 4,500 per month"
72857164,database administrator dba,adecco staffing & outsourcing sdn bhd,whats your expected monthly basic salary,petaling,information & communication technology,database development & administration,full time,"RM 8,000 – RM 11,000 per month"
72833005,sr analyst talent ld hse,cbre asia pacific business services sdn bhd,establishing systems and procedures to ensure the efficiency and effectiveness of the hse training offering advising staff on training policies and procedures including resolving or supporting the resolution of problems related to the operation of hse training providing administrative support for our annual mandatory training calendar developing and maintaining positive collaborative working relationships with all staff to sustain the reputation of the team as a customer focused function ensuring that confidentiality and security of sensitive information is maintained and complies with the requirements of gdpr supports the development and administration of the learning management system training records and associated processes identifies and solves problems that would otherwise delay training project completion conducts general data analysis creatingupdating excel spreadsheets building and maintaining dashboards identifies and communicates opportunities for process and quality improvements eks opportunities to increase internalexternal customer satisfaction evaluates business requirements related to using and configuring lms application maintains data rules and processes for the lms application works with internal stakeholders to ensure proper setup and system support for learning activities within the lms ensures training stakeholders are informed of the status of their training projects including implementation updates and changes and assisting with training course management attends meetings taking notes and progressing actions as required performs other related duties or special projects as assigned over 2 years of experience in utilizing lms platform preferably cornerstone on demand if it is not csod please specific the lms platform strong attention to detail and accuracy strong analytical and problemsolving skills preferably with experience in ld program management excellent interpersonal and stakeholder management skills with the ability to interact effectively with users at all levels diversemultinational background active listening and strong interpersonal skills to build rapport with clients understand their needs and tailor your approach accordingly flexibility and adaptability adjust your approach based on client feedback and changing circumstances,kuala lumpur,accounting,other,full time,
72684445,specialist procurement data analytic contract,infineon technologies (malaysia) sdn bhd,develop and implement strategies to increase efficiency within the organization analyze and evaluate existing processes and procedures to identify areas for improvement collaborate work together with stakeholders to implement changes and improvements create presentations to communicate findings and recommendations of automationsimprovements train and educate stakeholders on new processes and procedures to ensure successful implementation develop technical automations for continuous improvement monitor and measure the success of efficiency initiatives and make adjustments as necessary stay uptodate on industry trends and best practices related to efficiency and process improvement lead continuous improvement projects to drive longterm efficiency gains audit coordinating by scheduling calls with the sites gathering data from all stakeholders coordinating slides updates and audit calendar updates handling of audit related open topics bachelors degree in computer science information technologies engineering or related field or equivalent professional experience minimum 35 years working experiences in data analytics field strong analytical and problemsolving skills to identify inefficiencies and recommend solutions excellent communication skills to collaborate with teams and stakeholders to implement solutions proven experience in process improvement and efficiency implementation proficiency in data analysis and reporting collecting data cleaning data developing calculations publishing and analyzing results good command of ms office especially excel eg macros power query and data visualization tools tableau is a plus knowledge of process automation tools and low code applications,melaka,"manufacturing, transport & logistics",analysis & reporting,contract/temp,
72812300,senior specialist planning system reporting,infineon technologies (malaysia) sdn bhd,accountable and monitor accuracy and timeliness of master data updatemaintenance on newexisting product release accountable and monitor for accuracy and timeliness of master data archiving responsible to execute on master data related issue responsible for uat testing on fi solution sharing for newcrwork method implementation responsible master data process automation and improve according to business change bachelors degree in computer science information technology good verbal and written communication skills english problem solving and strategic analysis attributes good interpersonal skills able to interact effectively with various levels of people good logical understanding and rationalization skill,melaka,information & communication technology,networks & systems administration,full time,
72696366,system analyst,devsoft sdn bhd,how many years experience do you have as a systems analyst how would you rate your mandarin language skills which of the following relational database management systems rdbms are you experienced with have you worked in a role which requires a sound understanding of the software development lifecycle how many years experience do you have using sql queries,kuala lumpur,information & communication technology,business/systems analysts,full time,"RM 4,000 – RM 6,000 per month"
72698740,own worlds only ai franchise trainer side hustle worlds elite ai network,changeu international,,kuala lumpur,consulting & strategy,management & change consulting,part time,"RM 5,000 – RM 7,000 per month"
72718073,data privacy and protection officer,doo group,design and develop data privacy and data protection strategies policies and procedures in compliance with local laws and regulations monitor and assess the organizations data privacy practices to ensure compliance with applicable privacy laws such as the eu general data protection regulation gdpr personal data protection act pdpa in singapore and malaysia conduct privacy impact assessments pias to identify and mitigate potential privacy risks associated with data processing activities conduct periodic data privacy audits and risk assessments conduct privacy training and workshops for employees when necessary coordinate and cooperate with external consultants legal advisors and regulatory bodies on data privacyrelated matters collaborate with itproduct and crossfunctional teams to integrate privacy measures into software applications and systems monitor and investigate data breaches or incidents report them to the appropriate authorities and take appropriate remedial actions stay updated on emerging trends laws and regulations related to data privacyprotection and make recommendations accordingly possess at least a bachelors degree in information technology computer science law or any related field certified information privacy professional cipp or equivalent certification is a plus prior experience in dealing with data privacy regulations specifically gdpr proven experience in collaborating with itproduct departments to implement data privacyprotection measures familiarity with data privacy regulations in hong kong malaysia australia and other countries is an added advantage proficient in english and mandarin reading speaking and writing to liaise with hk cn counterparts effective communication skills to convey complex data privacy concepts to nontechnical stakeholders excellent analytical skills with superior attention to detail privacy risks and propose effective solutions a good team player with good interpersonal skills proactive with strong initiative positive attitude hardworking and able to multitask adaptable to fluid and fastpaced working environment 13th month salary performance bonus up to 16 epf contribution medical dental optical coverage best employee award team building activities festive seasons birthday celebration freeflow snacks and drinks rewarding career development with regional exposure friendly and open work environment with a young energetic team which of the following languages are you fluent in,kuala lumpur,banking & financial services,compliance & risk,full time,
72646741,system analyst,swift energy sdn bhd.,work closely with key stakeholders to deliver projects and it solutions work closely with managers and end users to analyze requests review system design and ensure compliance with technology architecture standards and system deployment perform sit and uat set up and maintain test environments troubleshoot and resolve technical issues reported in projects develop and review technical documents and system implementation planning according to the system development life cycle sdlc requirements enhancing the quality of it solutions and services by providing documentation and user training provide maintenance and support of existing systems to comply with the standards of the company and to perform related duties as needed candidate must possess at least a diploma bachelors degree in computer science information technology computer programming or equivalent three 3 years related working experience however candidates with lesser experience but with the right attitude are encouraged to apply good communication and presentation skills good troubleshooting and problemsolving skills ability to be selfmotivated and work independently comfortable with data analysis and able to understand and synthesize information from data required languages english mandarin bahasa malaysia required skills ms sql and database design time management project management and fundamental programming skills preferably candidate with experience in any of the following areas how many years experience do you have as a systems analyst whats your expected monthly basic salary,shah alam/subang,information & communication technology,business/systems analysts,full time,
72404940,system analyst,esri malaysia sdn bhd,medical benefits group insurance coverage yearly increment yearly bonus attractive staff claim eg dental optical health screening telecommunication accessories fun and energetic environment whats your expected monthly basic salary how many years experience do you have as a systems analyst which of the following microsoft office products are you experienced with,shah alam/subang,information & communication technology,business/systems analysts,full time,
72868651,manager technology commercialisation,universiti teknologi petronas (utp),recognised bachelors or masters degree in relevant field more than 8 years of experience in relevant field professional qualification and advanced degree would be an added advantage good written and verbal communication skills good interpersonal skills good analytical abilities whats your expected monthly basic salary,perak,marketing & communications,product management & development,full time,
