job_id,job_title,company,descriptions,location,category,subcategory,type,salary
72725474,it application analyst,segi fresh,develop maintain troubleshoot assigned software programming task including program design enhancement coding debugging and documentation provide system development support maintenance to ensure that the systems programs meets user requirements objectives collaborating with business analysts and developers to produce software designs perform upgrades to make software and systems more secure and efficient ensure the completion for new or enhancements of programs to meet the set deadline performing analytic studies of existing applications and reporting on their ability to meet company needs investigating diagnosing and resolving faults and errors in applications reporting and creating documentation for applications bachelors degree in information technology computer science or other relevant fields ability to exercise independent judgment and propose effective solutions to identified problems excellent analytical mathematical and problemsolving skills a good team player with strong interpersonal written and collaborating skills required skills net microsoft sql server mssql java php tsql retail background data analysis experience are added advantage good analytical and problemsolving skills selfmotivated independent positive working attitude whats your expected monthly basic salary,petaling,information & communication technology,business/systems analysts,full time,
72276840,product data analyst intern hybrid working,seek asia (jobstreet),outcomeoriented obsessively focused on how we can make a difference to our customers evidence led systematically creatively and rigorously using data to drive insights iterative consistently adapting to the learning acquired through experiments and measurement for growth purpose curiosity asking good questions out of curiosity to drive insights rigorous dataliterate organized and clearthinking semitechnical learn web digital analytics google analytics and adobe analytics business intelligence tools power bi and tableau and willing to learn other skills collaborative a good team player motivated by team and company success generous in supporting others passionate about understanding complex issues able to think critically and learnings from evidence articulate able to clearly express ideas verbally and in writing building maintaining and improving dashboards for performance health monitoring and tracking effectiveness of initiatives for teams work with business owners stakeholders to define project objectives kpis and okrs define and prepare measurement specifications and implementation requirements for initiatives across platforms desktop mobile site etc deliver accurate and valueadding actionable insights of candidate behaviour to the closed stakeholders provide pre and postlaunch reviews of initiatives experiments communicate clear data analysis and actionable insights to enable stakeholders in making informed decisions handle data queries from stakeholders perform other analysis like competitor study rootcause analysis hypothesis testing opportunity impact study on the agreed problems keen interest in data analysis strategy or researchrelated roles strong analytical skills and critical thinking skills strong collaborator to build and maintain relationships with teams data insights team stakeholders and peers a good foundation with statistical knowledge practices and application in business ability to motivate and lead internal external teams to deliver results beyond expectations ability to work in a fastpaced global business environment and manage stakeholders expectations across different time zones good intellect with a passion for understanding customers hirers and candidates behaviour satisfaction and loyalty businessoriented recommendations good communicator with excellent presentation skills ownership accountability and drive delivering outcome with crossfunctional and crossproduct teams ability to establish relationships and influence senior stakeholders from a diversified culture without authority collaborative a good sense of humility and empathetic working style a deep commitment to inclusive and empowering work practices web analytics adobe analytics google analytics google search console google adwords ab testing etc business intelligence tools tableau power bi etc databricks supports sql python r scala etc 6 months internship,kuala lumpur,information & communication technology,business/systems analysts,contract/temp,
72769966,database administrator,public mutual berhad,execute daily database operations and maintain database security access assist in the installation upgrade patching and migration of database servers monitor and fine tune database performance perform timely data replication backup recovery and archival assist in other adhoc projects as and when required degree in computer science information technology or equivalent minimum 1 year of working experience in database management ie oracle mssql mysql nosql database a good team player who possesses a positive work attitude and able to work independently fresh graduates or applicants without relevant experience but who have strong academic credentials will also be considered whats your expected monthly basic salary,kuala lumpur,information & communication technology,database development & administration,full time,
72862220,microstrategy developers mnc,ag staffing malaysia,ideally with at least 6 years of development experience in microstrategy mstr handson experience in microstrategy components like mstr architect desktop developer mstr administration web distribution services transaction services and sdk experience in creating microstrategy schema and application objects such as logical tables attributes facts hierarchies metrics prompts filters consolidations and custom groups good understanding and knowledge of star snowflake dimensional data modelling data warehouse and reporting techniques experience in designing semantic layers for data warehouse projects strong sql skills and ability to create simple to complex schema objects as the requirements experience in working with logical data models different types of hierarchies in microstrategy experience in working with complex microstrategy reports using advanced filters level metrics transformation metrics and using passthrough functions in the schema objects experience in implementing microstrategy security model experience in object manager enterprise manager command manager and the system manager experience in performance tuning of various reports and dashboards using vldb properties whats your expected monthly basic salary,kuala lumpur,information & communication technology,developers/programmers,full time,"RM 11,000 – RM 12,000 per month"
72524189,data modeler,etiqa insurance & takaful,3 years of handson experience in data analytics data modelling and data visualization diplomadegree in it related discipline undergone training related to business analysis and data modelling such as certified data management professional cdmp data mapping and data modeling technique efficient database design and experience with oracle database knowledge in plsql confident operating within an agile development process possesses good understanding in the areas of data quality and master data management work closely with internal it and business user during the planning phases and become the primary technology owner of the data warehouse solution going forward,bangsar,information & communication technology,business/systems analysts,full time,
72436685,ai engineer,mi equipment (m) sdn. bhd.,perform research and development in ai model model training and deployment keep abreast of ai technologies and products in the market accountable for software and hardware buyoff qualification and reporting utilize advanced analytics techniques or ai to analyze large volumes of data or images generated by machine for diagnostic applications extract meaningful insights trends and patterns from complex datasets to inform decisionmaking processes work closely with the development team to identify areas for improvement in data collection storage and analysis processes create visually appealing and easytounderstand dashboards reports and visualizations to communicate complex data findings to both technical and nontechnical stakeholders undertake other duties and responsibilities which may be assigned by the company from time to time with on time full closure degree in engineering or science in electronics electrical mechatronics computer with second upper class or above well versed in python and c programming language and familiar with tensor flow pytorch and opencv firm understanding of algorithm theory related to machine learning such as gradient descent autoencoder and convolutions knowledgeable both theoretically and practically on devops computer vision machine learning deep learning neural networks and optimization algorithm experience of managing the infrastructure and data pipelines needed to bring machine learning solutions to production is an added advantage strong technical leadership analytical problemsolving skills ability to think creatively and work well both as individual contributor and as part of teams positive working attitude and willingness to provide extended support to customers enjoy learning new things and willing to accept new challenges how many years experience do you have as an artificial intelligence engineer whats your expected monthly basic salary are you willing to undergo a preemployment background check,penang island,engineering,electrical/electronic engineering,full time,
72422694,consulting analyst artificial intelligencedatamydata sciencedata engineer,deloitte consulting sea,apply emerging technologies to help our clients maximize the value of their data by generating actionable insights that provide real business outcomes design and implement data structures to support big data analytical models and traditional bidw reporting solutions using technologies such as microsoft sql oracle sap cloudera ibm watsons mulesoft qlik technologies or informatica design and develop data integration using data governance data quality mdm and metadata management apply analytical models to predict business outcomes with tools such as datarobot and languages like python or r you will be part of a collaborative team that provides our clients with solutions that are practical as well as visionary and have an impact from the back office to the boardroom support the project teams in recommending bidwanalytics processes governance organizational and platform models tool selections and data integration options to clients strong academic performance in computer science computer engineering statistics mathematics engineering or related disciplines proficient in at least one programming language python c java etc good understanding in artificial intelligence and machine learning understanding of sdlc waterfall and agile development methodologies some knowledge of intelligence automation software eg automation anywhere blueprism uipath or workfusion or cloud platforms eg amazon web services aws google cloud platform gcp or microsoft azure an interest in data ingestion and transformation pipelines using big data technologies including one or more of the following spark hive pig kafka mapreduce hbase sqoop flume or storm general knowledge of linuxunix based operating systems and shell scripting would be an advantage demonstrates interest for all the latest technologies libraries languages strong analytical skills selfmotivated and able to work in stressful situations with changing priorities drive tenacity entrepreneurship client focused and results oriented you enjoy working methodically and with a great attention to detail proven demonstration of sound business acumen teamwork confidence in public speaking and presentation preparation is appreciated whats your expected monthly basic salary how would you rate your english language skills,kuala lumpur,information & communication technology,consultants,full time,
72733305,database administrator,snsoft sdn. bhd.,13th months salary upon company declaration project incentive upon company declaration based on project performance transport meal birthday allowances upon confirmation medical dental claim sports activities badminton basketball team building activities training and certification sponsored by company selected employees rewards and recognition long service award best performer award role model awards etc smart casual attire yearly annual dinner designs and plans database structural architecture requirements by analyzing and reviewing client operations applications and programming evaluate current systems buildconfigure various types of databases such as mongo mysql and redis database replication based on business development trends evaluate plan and perform the db upgrades backup recovery and data migration design and implement disaster recovery plans high availability solutions and recommendations based on different types of databases setup and maintain linux based systems used for the database setup and manage on cloud aws services and databases to be responsible perform daily database related tasks such as create publish and monitor database health checks to monitoring systems to identify slow queries replication lags node failures index usage patterns cpu usage memory usage locks number of connections and any other relevant parameters drive best practices for backups replication and health checks work closely with the application team to understand what changes are coming in a buildpatchhotfix do an impact analysis finetune the queries if any automate the database repetitive tasks to assess database implementation procedures to ensure they comply with internal and external regulations candidates must possess at least a bachelors degreepostgraduate diplomaprofessional degree in computer scienceinformation technology or equivalent at least 2 years handson experience as database administrator in production environments preferably candidates who are proficientfamiliar with mysql mongodb database operating mechanismarchitecture including performance optimization and adjustment proficiency in writing debugging procedures functions and sql statements strong scripting experience in unixshell scripting and python candidate who is experienced in aws is a plus point preferably candidates with strong troubleshooting skills have good technical sense and ability in document integration preferably candidates who are eager to learn new technology prefer candidates who can speak basic mandarin which of the following relational database management systems rdbms are you experienced with whats your expected monthly basic salary which of the following languages are you fluent in which of the following programming languages are you experienced in how would you rate your mandarin language skills how many years experience do you have as a database administrator do you have customer service experience which of the following linux distributions are you familiar with,kuala lumpur,information & communication technology,database development & administration,full time,"RM 8,500 – RM 12,000 per month"
72524223,data quality analyst,etiqa insurance & takaful,diplomadegree in it related discipline computer science information technology business or a related field proven experience 3 years in data management data quality assurance or a similar role strong understanding of data quality concepts data profiling and data cleansing techniques proficiency in data analysis tools and sql for querying and manipulating data excellent attention to detail and problemsolving skills effective communication skills to collaborate with both technical and nontechnical teams ability to work independently and prioritize tasks in a fastpaced environment knowledge of data governance frameworks and practices is a plus experience with data quality tools or software is an advantage work location datar maybank bangsar employment term 12 months contract renewalabsorb,bangsar south,information & communication technology,database development & administration,full time,
72415435,software engineer,optimai (malaysia) sdn bhd,devops cicd cyber security generative ai machine learning web mobile frontend development business intelligence data analytics backend development software testing and automation system server admin devops cicd experience with cicd tools jenkins gitlab ci or azure devops containerization and orchestration tools dockers kubernetes cloud services aws azure gcp and serverless architectures cyber security proficiency with security audit tools intrusion detection systems knowledge of secure coding practices ethical hacking and firewall management familiarity with compliance frameworks such as iso 27001 nist gdpr generative ai machine learning chatgpt embeddings vector databases classification association time series prediction using ml techniques etc web mobile frontend development net core mvc javascript vuejs bootstrap angular rest apis etc business intelligence data analytics tableau power bi devexpress sql etc backend development database design sql programming performance optimization microsoft sql server rest apis wcf python etc software testing automation blackwhite box testing automated testing sql apis system server admin ad sccm backup restore it security hyperv azure aws financial industry capital markets wealth management banking investment data warehouse portfolio analytics stock trading margin financing portfolio financing securities borrowing lending contracts for difference leveraged fx loans syndicated loans crypto assets private equity factoring supply chain financing,kuala lumpur,information & communication technology,engineering - software,full time,
72426635,data analyst,etiqa insurance & takaful,diplomadegree in it related discipline computer science information technology business or a related field strong understanding of data quality concepts data profiling and data cleansing techniques engage business units to understand business opportunities extract data perform data manipulation analysis for business insights and document analysis deploy new or tweak existing business intelligence dashboard to help organization make data driven decision craft experiments to produce business uplift employment contract for 6 months 12 months renewalabsorb work location datar maybank bangsar,bangsar,information & communication technology,business/systems analysts,contract/temp,
72403257,data engineer,kinesso malaysia sdn. bhd. (fka mediabrands global technology solutions sdn bhd),perform daily weekly and monthly monitoring on data and process to ensure data integrity and preserve data accuracy completeness recency timeliness accuracy provide advanced supportto internal and external users for data reporting and technologyrelated questions and concerns work with stakeholders including the productteam clients and their agency to assist with datarelated technical issues and support their data needs perform data analysis involving navigating and reviewinglarge data sets to answer specific business questions perform root cause analysis on reported data or processesissue and resolve them from end to end create accessible documentsand keeping the existingdocumentations upto date understand the importance of the issuesresulting in prioritizing and escalating when is required experience working with sql pythonaws snowflake good troubleshooting and data analytical skills with keen attention to detail be able to understand the business requirements verify data identifydata and identify potential data issues experience performing root cause analysison internal and external data and processes good communication skills and experience workingwith crossfunctional teams in a dynamic environment selfdirected and comfortable supporting the data needs of multiple teams systems and products familiar with aws services git jenkins airflow proficient in english as a first language both verbal written excellent communication skills with the ability to effectively interact with nontechnical users result driven high enthusiasm and can work well with others strong desire to learn new things and pass knowledge acquired onto others able to manage own hours and work with a remote team environment how many years experience do you have as a data engineer,petaling,science & technology,"mathematics, statistics & information sciences",full time,
72712849,lead learning and educational development,taylor's education group,involves in the strategic planning design implementation and evaluation of the academic staff and academic leaders development initiatives for both taylors university and taylors college designs and conducts high quality and impactful training modules on teaching and learning to support taylors strategic initiatives conducts training needs analysis based on evidencebased approach designs and monitors academic staff evaluation and learning plan provides guidance to academics in managing their pedagogical knowledge and skills development involves in the planning design and implementation of the taylors teaching and learning conference ttlc plans designs implements and evaluates of the academic staff development initiatives and teaching engagement scale tes to support taylors curriculum framework tcf support academic heads in designing and monitoring academic staff learning plan support academic heads in development intervention for identified academic staff to improve their teaching and student learning any other responsibilities that may be assigned from time to time leadership skills value team work commitment to learn and upskill people management skills stakeholder management skills communication and persuasion skills with customers colleagues business contacts in a courteous and professional manner creative thinking and problem solving analytical and report writing skills planning coordinating and organising skills interpersonal skills creative resourceful independent proactive and customer focused results oriented resourceful and proactive knowledge of different pedagogies appropriate to varied learning environments in higher education knowledge and understanding of the application of learning technology knowledge of current trends in the pedagogy of teaching and learning experience in the development of learning and teaching methodologies technology savvy well organized and meticulous good analytical problem solving interpersonal networking and communication skills leadership organizing problem solving skills and project management skills high level understanding and commitment to issues related to academic staff development has a strong sense of responsibility ability to engage various academic professionals ability to solve process and people problems ability to think ahead and anticipate results ability to lead projects and initiatives,petaling,education & training,management - universities,full time,
72540519,data analyst,global parcel service (m) sdn bhd,growth opportunities international vision promising career development develop and automate dashboards analyses and reports to support business functions collaborate with stakeholders in operations and sales to make datadriven decisions create pipelines and queries in the data warehouse maintain the integrity of the data as the single source of truth coding skills basic knowledge of programming languages such as stata sql r studio c for logistics jobs that involve data analysis automation and optimization data analysis skills the ability to analyze large datasets identify patterns and extract insights is essential for logistics jobs that involve forecasting planning and decisionmaking communication skills logistics professionals need to communicate effectively with team members to ensure that results are delivered in a timely manner problemsolving skills logistics professionals need to be able to identify and solve problems quickly and efficiently to minimize delays attention to detail logistics professionals need to be detailoriented to ensure that shipments are accurate complete and compliant with regulations candidates with prior work experience in relevant fields are preferred excellent communication and interpersonal skills able to work well with crossfunctional teams strong problemsolving skills which of the following statements best describes your right to work in malaysia whats your expected monthly basic salary how many years experience do you have as a data analyst which of the following microsoft office products are you experienced with how would you rate your english language skills which of the following languages are you fluent in are you willing to undergo a preemployment background check how much notice are you required to give your current employer,petaling,"manufacturing, transport & logistics",analysis & reporting,full time,"RM 3,500 – RM 5,000 per month"
